{
  "avatar_explanation": {
    "summary": "This avatar experiences tinnitus as a jaw-linked state problem, not a generic ear problem. The ring often gets louder when they clench, yawn, turn the head, side-sleep, or lie down, and the hearing test often comes back normal anyway. That combination pushes them into specialist ping-pong, night-guard confusion, and mechanism-hungry self-diagnosis. They want a believable explanation for the jaw / posture / sleep loop and relief that makes nights feel safe again.",
    "confidence": "high",
    "evidence": [
      {
        "thread_id": "t3_1i0vu0n",
        "submission_id": "1i0vu0n",
        "comment_id": null,
        "subreddit": "tinnitus",
        "quote": "my T is unilateral, gets louder when I open my mouth wide, louder when I turn my head one way",
        "why_it_supports": "Shows the sufferer reading the problem through jaw and head mechanics rather than through random ear noise."
      },
      {
        "thread_id": "t3_1ppavkn",
        "submission_id": "1ppavkn",
        "comment_id": null,
        "subreddit": "tinnitus",
        "quote": "Often quiet or barely noticeable in the morning, but much louder at night or when lying down",
        "why_it_supports": "Captures the signature cadence of this cluster: quieter early, louder in bed, and emotionally heavier at night."
      },
      {
        "thread_id": "t3_1fq0gbq",
        "submission_id": "1fq0gbq",
        "comment_id": null,
        "subreddit": "tinnitus",
        "quote": "I was completely unaware that I grind teeth until now.",
        "why_it_supports": "Shows the hidden-bruxism discovery path that pulls this avatar into the jaw/TMJ lane."
      }
    ]
  },
  "age": {
    "value": null,
    "confidence": "low",
    "notes": "The local slice reads like a working-age behavior cluster, but explicit self-reported ages are too sparse and inconsistent to lock a reliable age band.",
    "evidence": []
  },
  "gender": {
    "value": null,
    "confidence": "low",
    "notes": "The local slice reads cross-gender. The state cluster is stronger and more reliable than any gender signal in the current corpus.",
    "evidence": []
  },
  "pain_points": [
    {
      "label": "Bedtime and wake-up spikes feel like an ambush",
      "summary": "Their worst moments are often when the room goes quiet, when they lie down, or when they wake up sore from clenching. The suffering is temporal and positional, not evenly distributed.",
      "confidence": "high",
      "evidence": [
        {
          "thread_id": "t3_1ppavkn",
          "submission_id": "1ppavkn",
          "comment_id": null,
          "subreddit": "tinnitus",
          "quote": "Often quiet or barely noticeable in the morning, but much louder at night or when lying down",
          "why_it_supports": "Shows the core day-part pattern that makes bedtime and lying down emotionally charged."
        },
        {
          "thread_id": "t3_1acjwdh",
          "submission_id": "1acjwdh",
          "comment_id": null,
          "subreddit": "tinnitus",
          "quote": "laying down on the bed, with my jaw on the pillow, it puts pressure on the jaw and causes the tinnitus to spike",
          "why_it_supports": "Shows how sleep position and pillow pressure are treated as direct spike triggers."
        },
        {
          "thread_id": "t3_1acjwdh",
          "submission_id": "1acjwdh",
          "comment_id": null,
          "subreddit": "tinnitus",
          "quote": "when waking up, my jaw is sore",
          "why_it_supports": "Links the morning spike to overnight clenching carryover rather than a random flare."
        }
      ]
    },
    {
      "label": "It feels like a whole jaw-ear system is off, not just a sound",
      "summary": "This avatar rarely describes only ringing. Ear fullness, clogged feeling, clicking, jaw tightness, bite shift, and pain travel with the sound and make the problem feel physical.",
      "confidence": "high",
      "evidence": [
        {
          "thread_id": "t3_1ppavkn",
          "submission_id": "1ppavkn",
          "comment_id": null,
          "subreddit": "tinnitus",
          "quote": "Ear fullness / clogged feeling at times",
          "why_it_supports": "Shows that the condition is felt as pressure and fullness, not only as ringing."
        },
        {
          "thread_id": "t3_1i0vu0n",
          "submission_id": "1i0vu0n",
          "comment_id": null,
          "subreddit": "tinnitus",
          "quote": "have intermittent clicking when I move my jaw",
          "why_it_supports": "Shows the jaw-clicking piece that makes the tinnitus story feel mechanically anchored."
        },
        {
          "thread_id": "t3_1fq0gbq",
          "submission_id": "1fq0gbq",
          "comment_id": "nse7o09",
          "subreddit": "tinnitus",
          "quote": "tinnitus and that weird ear-clicking started showing up out of nowhere",
          "why_it_supports": "Shows the symptom bundle arriving together and reinforcing the physical-root-cause belief."
        }
      ]
    },
    {
      "label": "Normal tests do not reduce distress",
      "summary": "When hearing tests come back normal, sufferers do not feel safe. They feel invalidated, confused, and even more desperate to prove the jaw / sleep / posture story.",
      "confidence": "high",
      "evidence": [
        {
          "thread_id": "t3_1i0vu0n",
          "submission_id": "1i0vu0n",
          "comment_id": null,
          "subreddit": "tinnitus",
          "quote": "no hearing loss (my hearing is fine from 2 different hearing tests)",
          "why_it_supports": "Shows the mismatch between objective test reassurance and ongoing symptom distress."
        },
        {
          "thread_id": "t3_1ppavkn",
          "submission_id": "1ppavkn",
          "comment_id": null,
          "subreddit": "tinnitus",
          "quote": "Multiple hearing tests — all normal",
          "why_it_supports": "Shows that repeated normal testing is common inside this cluster."
        },
        {
          "thread_id": "t3_1p4r4jp",
          "submission_id": "1p4r4jp",
          "comment_id": null,
          "subreddit": "tinnitus",
          "quote": "1.5 years with this thing screaming in my ear and yet a perfect hearing test",
          "why_it_supports": "Captures the gaslighting dynamic in the exact words the market uses."
        }
      ]
    },
    {
      "label": "They are afraid the wrong fix will make it worse",
      "summary": "The audience is not merely solution-seeking. It is damage-avoidant. Many already believe a guard, splint, or dental step has aggravated the ring.",
      "confidence": "high",
      "evidence": [
        {
          "thread_id": "t3_10p8kys",
          "submission_id": "10p8kys",
          "comment_id": "o3dddrl",
          "subreddit": "tinnitus",
          "quote": "my tinnitus went from manageable to louder than life",
          "why_it_supports": "Shows why this avatar flinches at anything that touches bite, jaw position, or nighttime clenching."
        },
        {
          "thread_id": "t3_1i0vu0n",
          "submission_id": "1i0vu0n",
          "comment_id": "m71j405",
          "subreddit": "tinnitus",
          "quote": "it only encouraged me to clench and caused pain",
          "why_it_supports": "Shows how even expensive custom help can become a backfire story."
        },
        {
          "thread_id": "t3_1lz9pq5",
          "submission_id": "1lz9pq5",
          "comment_id": null,
          "subreddit": "tinnitus",
          "quote": "they charge $600 for the consultation and $5,000 to $10,000 for treatment.",
          "why_it_supports": "Shows that the risk is not only symptom worsening but also costly regret."
        }
      ]
    }
  ],
  "day_to_day_struggles": [
    {
      "label": "They constantly monitor jaw position, posture, and sleep mechanics",
      "summary": "Day-to-day life becomes a monitoring routine: Am I clenching? Did the pillow push my jaw? Am I slouching? Did that head turn change the pitch?",
      "confidence": "high",
      "evidence": [
        {
          "thread_id": "t3_1acjwdh",
          "submission_id": "1acjwdh",
          "comment_id": null,
          "subreddit": "tinnitus",
          "quote": "After realizing this, i now actively make sure im not clenching my teeth once in a while",
          "why_it_supports": "Shows the constant self-checking behavior that becomes part of daily survival."
        },
        {
          "thread_id": "t3_1lz9pq5",
          "submission_id": "1lz9pq5",
          "comment_id": "n3071bb",
          "subreddit": "tinnitus",
          "quote": "I think it’s TMJ, Bruxism and posture related as I notice it more when slouching.",
          "why_it_supports": "Shows posture becoming something they actively watch throughout the day."
        }
      ]
    },
    {
      "label": "Quiet work and screen-heavy posture become trigger environments",
      "summary": "The problem is not confined to bedtime. Driving, desk work, and long hours sitting still can all feel like aggravators because they tighten the same jaw/neck system.",
      "confidence": "medium",
      "evidence": [
        {
          "thread_id": "t3_147csmq",
          "submission_id": "147csmq",
          "comment_id": "mvhchbf",
          "subreddit": "tinnitus",
          "quote": "I have a long drive, I'm guessing my posture while I'm driving is affecting it too.",
          "why_it_supports": "Shows the cluster spilling into commuting and seated daily routine, not just nights."
        },
        {
          "thread_id": "t3_1mbvuup",
          "submission_id": "1mbvuup",
          "comment_id": null,
          "subreddit": "tinnitus",
          "quote": "forward head posture from sitting at a desk and staring at screens all day.",
          "why_it_supports": "Shows why work posture and screen time matter psychologically inside this avatar."
        }
      ]
    },